{
  "tc_id": "TC-015",
  "tc_name": "KM Curve with Risk Table",
  "metadata": {
    "n_total": 200,
    "n_experimental": 111,
    "n_control": 89,
    "events_experimental": 67,
    "events_control": 62,
    "population": "ITT",
    "time_unit": "months",
    "time_points": [0, 3, 6, 9, 12, 15, 18, 21, 24, 30],
    "r_version": "R version 4.6.0 (2026-04-24)",
    "package": "survival"
  },
  "overall_median": {
    "median": 8.21,
    "ci_lower": 6.95,
    "ci_upper": 11.2
  },
  "logrank": {
    "chisq": 3.7261,
    "df": 1,
    "p_value": 0.0536
  },
  "curve_experimental": {
    "time_points": [0, 3, 6, 9, 12, 15, 18, 21, 24, 30],
    "survival": [1, 0.784, 0.6338, 0.5284, 0.4284, 0.3966, 0.2896, 0.2478, 0.2027, 0.0845],
    "ci_lower": [1, 0.7077, 0.5429, 0.4326, 0.3325, 0.3012, 0.1991, 0.1607, 0.1211, 0.0264],
    "ci_upper": [1, 0.8685, 0.74, 0.6454, 0.552, 0.5222, 0.4213, 0.3822, 0.3394, 0.2704],
    "n_at_risk": [111, 72, 51, 37, 30, 24, 15, 11, 8, 2],
    "n_events": [0, 22, 13, 8, 7, 2, 6, 2, 2, 3],
    "n_censored": [0, 17, 8, 6, 0, 4, 3, 2, 1, 3]
  },
  "curve_control": {
    "time_points": [0, 3, 6, 9, 12, 15, 18, 21, 24, 30],
    "survival": [1, 0.7095, 0.5764, 0.3547, 0.3173, 0.2136, 0.1899, 0.1139, 0.0854, 0.0427],
    "ci_lower": [1, 0.6177, 0.4769, 0.2572, 0.2222, 0.1295, 0.1094, 0.0507, 0.0318, 0.0078],
    "ci_upper": [1, 0.8149, 0.6966, 0.4891, 0.4533, 0.3522, 0.3293, 0.256, 0.2294, 0.2343],
    "n_at_risk": [89, 55, 40, 21, 17, 10, 8, 4, 3, 1],
    "n_events": [0, 24, 10, 14, 2, 5, 1, 3, 1, 1],
    "n_censored": [0, 10, 5, 5, 2, 2, 1, 1, 0, 1]
  }
}
